cvx_code,short_description,full_vaccine_name,note,vaccine_status,internal_id,nonvaccine,update_date
327,"Pneumococcal conjugate PCV21, polysaccharide CRM197 conjugate, PF","Pneumococcal conjugate vaccine, 21 valent (PCV21), polysaccharide CRM197 conjugate, preservative free",,Active,302,False,2024-07-11
328,"Meningococcal oligosaccharide (MenACWY), (MenB), PF","Meningococcal oligosaccharide conjugated (groups A, C, W, Y) and group B, 0.5 mL, preservative free",Meningococcal pentavalent vaccine strains ABCW and Y,Active,303,False,2025-03-18
329,"Chikungunya, VLP, recombinant, 0.8 mL, PF","Chikungunya, virus-like particle (VLP), recombinant vaccine, 0.8 mL, preservative free",,Active,304,False,2025-03-18
330,"Dengue fever, unspecified","Dengue fever, unspecified formulation","Use this CVX for historical records where; the formulation of the dengue vaccine administered is not known, or is a non-US product without an associated CVX code.",Inactive,305,False,2025-04-30
331,"Influenza, Southern Hemisphere, trivalent, PF","Influenza, seasonal, Southern Hemisphere, trivalent, 0.5 mL dose, preservative free",Represents single dose vial,Active,306,False,2025-04-30
325,"Vaccinia (smallpox, mpox), unspecified","Vaccinia (smallpox, mpox), unspecified","Use this CVX for historical records where; the formulation administered is not known, or is a non-US product without an associated CVX code.",Inactive,307,False,2025-05-02
332,"RSV, mAb, clesrovimab-cfor, 0.7 mL, neonate and infant, PF","Respiratory syncytial virus (RSV), monoclonal antibody, IgG1κ , (clesrovimab-cfor), 0.7 mL, neonate and infant, preservative free",RSV mAb for neonates and infants born during or entering first RSV season (Enflonsia),Active,308,False,2025-07-03
333,"Influenza, live, trivalent, intranasal, self/caregiver admin, PF","Influenza, live, trivalent, intranasal, self or caregiver administered, preservative free","Self or caregiver administered, new starting 2025/2026 season",Active,309,False,2025-07-15
302,"COVID-19, mRNA, LNP-S, bivalent, PF, 3 mcg/0.2 mL dose","SARS-COV-2 (COVID-19) vaccine, mRNA, spike protein, LNP, bivalent, preservative free, 3 mcg/0.2 mL dose, tris-sucrose formulation","Original strain + omicron BA.4/BA.5 bivalent Pfizer vaccine (6 mo through 4 yrs), FDA rescinded 09/11/2023",Inactive,310,False,2023-10-26
